{
  "schemaVersion": "0.1.0",
  "contractType": "template-index",
  "templateIndexId": "synthetic-template-index",
  "templateProfileId": "synthetic-template-profile",
  "templateFormat": "potx",
  "templateSha256": "0123456789abcdef0123456789abcdef0123456789abcdef0123456789abcdef",
  "presentationPart": "ppt/presentation.xml",
  "slideSizeEmu": {
    "cx": 12192000,
    "cy": 6858000
  },
  "observedFeatureIds": [
    "content-types-and-relationships",
    "drawingml-shapes",
    "masters-layouts-themes",
    "package-container",
    "slide-text"
  ],
  "masters": [
    {
      "masterKey": "master-1",
      "sourceId": 2147483648,
      "partPath": "ppt/slideMasters/slideMaster1.xml"
    }
  ],
  "layouts": [
    {
      "layoutKey": "content-layout",
      "sourceId": 2147483649,
      "partPath": "ppt/slideLayouts/slideLayout1.xml",
      "masterKey": "master-1",
      "shapes": [
        {
          "shapeKey": "body-placeholder",
          "sourceId": 3,
          "kind": "placeholder",
          "geometry": { "x": 914400, "y": 1828800, "cx": 10363200, "cy": 3657600 },
          "placeholder": { "type": "body", "index": 1 }
        },
        {
          "shapeKey": "title-placeholder",
          "sourceId": 2,
          "kind": "placeholder",
          "geometry": { "x": 914400, "y": 457200, "cx": 10363200, "cy": 914400 },
          "placeholder": { "type": "title", "index": 0 }
        }
      ]
    }
  ],
  "slides": [
    {
      "slideKey": "slide-1",
      "sourceId": 256,
      "partPath": "ppt/slides/slide1.xml",
      "layoutKey": "content-layout",
      "shapes": [
        {
          "shapeKey": "body-placeholder",
          "sourceId": 3,
          "kind": "placeholder",
          "geometry": { "x": 914400, "y": 1828800, "cx": 10363200, "cy": 3657600 },
          "placeholder": { "type": "body", "index": 1 }
        },
        {
          "shapeKey": "title-placeholder",
          "sourceId": 2,
          "kind": "placeholder",
          "geometry": { "x": 914400, "y": 457200, "cx": 10363200, "cy": 914400 },
          "placeholder": { "type": "title", "index": 0 }
        }
      ]
    }
  ]
}
